{
  "meta": {
    "task_id": "task-5d609339e218",
    "trace_id": "task-5d609339e218",
    "stage": "fix",
    "generated_at": "2026-02-09T02:47:38.530355+00:00",
    "source_language": "COBOL",
    "target_language": "Java",
    "module": "UNKNOWN"
  },
  "unknowns": [],
  "extensions": {},
  "applied": false,
  "target_code": "package com.migration.generated;\n\n/**\n * 移行元: HELLO-WORLD\n * 生成者: CodeMigrationAgent\n */\npublic class HelloWorld {\n\n    // === Fields (WORKING-STORAGE) ===\n    private String message;\n\n    // === Methods (PROCEDURE DIVISION) ===\n    // TODO: LLM will generate method implementations\n\n    public static void main(String[] args) {\n        HelloWorld instance = new HelloWorld();\n        // TODO: Call entry point method\n    }\n}",
  "patch_summary": [
    "裁定が TRANSFORM_ISSUE 以外のため修正を実施しない"
  ],
  "retest_required": false
}